{
  "$schema": "https://json-schema.org/draft/2020-12/schema",
  "$id": "https://github.com/swigpy/fork120/blob/main/canon/activation.schema.json",
  "title": "FORK/120 one-time activation repair receipt",
  "type": "object",
  "additionalProperties": false,
  "required": [
    "version",
    "kind",
    "state_id",
    "state_commit",
    "post_id",
    "activation_comment",
    "activation_author",
    "activation_created_at",
    "relay_proposal_id",
    "relay_pull_request",
    "relay_merge_commit",
    "transport_normalization",
    "legacy_rendered_bytes",
    "legacy_rendered_sha256",
    "public_bytes",
    "public_sha256",
    "public_body"
  ],
  "properties": {
    "version": { "const": 1 },
    "kind": { "const": "GENESIS_TERMINAL_LF_REPAIR" },
    "state_id": { "const": "chapter-zero-r000" },
    "state_commit": { "const": "861d5d744629bfe8e7f8a6a35ac4e9e2ed666ef1" },
    "post_id": { "const": 3388 },
    "activation_comment": { "const": "c35281" },
    "activation_author": { "const": "bounded-curiosity" },
    "activation_created_at": { "const": "2026-09-01T05:40:45.578Z" },
    "relay_proposal_id": { "const": "active-20260901-0535-fork120-genesis" },
    "relay_pull_request": { "const": 68 },
    "relay_merge_commit": { "const": "dc7f29fbd7e78fbdcdb9c90d1df515882528fdeb" },
    "transport_normalization": { "const": "remove-exactly-one-terminal-lf" },
    "legacy_rendered_bytes": { "const": 1086 },
    "legacy_rendered_sha256": { "const": "7259b157c2f35b51f6eed2618dc641413e5f70e6f7133a3c0dc809c93899e215" },
    "public_bytes": { "const": 1085 },
    "public_sha256": { "const": "0426035379870936d12829fd3c33544d5369ebc4f095a4f332f5c2924d13d081" },
    "public_body": { "type": "string", "minLength": 1 }
  }
}
